<?xml version="1.0" encoding="utf-8"?>
<wii:instrument xmlns:xsi="http://www.w3.org/2001/XMLSchema-instance"
         xmlns:wii="http://www.wwidesigner.com/Instrument"
         xsi:schemaLocation="http://www.wwidesigner.com/Instrument ../Instrument2.xsd ">
	<name>BP7 Whistle</name>
	<description>6-hole PVC whistle, high D, A=440 Just Intonation</description>
	<lengthType>mm</lengthType>
	<mouthpiece>
		<position>267.5</position>
		<fipple>
			<windowLength>5.4</windowLength>
			<windowWidth>6.5</windowWidth>
			<windowHeight>3.6</windowHeight>
			<windwayLength>21.</windwayLength>
			<windwayHeight>1.36</windwayHeight>
		</fipple>
		<beta>0.4</beta>
	</mouthpiece>
	<boreDiameter>11.9</boreDiameter>
	<hole>
		<position optimization="FREE">150.5</position>
		<diameter optimization="FREE">5.6</diameter>
		<height>2.0</height>
	</hole>
	<hole>
		<position optimization="FREE">128.0</position>
		<diameter optimization="FREE">6.0</diameter>
		<height>2.0</height>
	</hole>
	<hole>
		<position optimization="FREE">109.0</position>
		<diameter optimization="FREE">6.0</diameter>
		<height>2.0</height>
	</hole>
	<hole>
		<position optimization="FREE">81.0</position>
		<diameter optimization="FREE">6.0</diameter>
		<height>2.0</height>
	</hole>
	<hole>
		<position optimization="FREE">64.5</position>
		<diameter optimization="FREE">7.9</diameter>
		<height>2.0</height>
	</hole>
	<hole>
		<position optimization="FREE">40.0</position>
		<diameter optimization="FREE">7.5</diameter>
		<height>2.0</height>
	</hole>
	<termination>
		<flangeDiameter>15.9</flangeDiameter>
	</termination>
</wii:instrument>
